{
  "platform": "kilocode",
  "displayName": "KiloCode",
  "installType": "full",
  "folderStructure": {
    "root": ".kilocode",
    "skillPath": "skills/dsprag",
    "filename": "SKILL.md"
  },
  "scriptPath": "scripts/install-skill.mjs",
  "frontmatter": {
    "name": "dsprag",
    "description": "DSP RAG installer profile for KiloCode"
  },
  "sections": {
    "quickReference": true
  },
  "title": "DSP RAG KiloCode",
  "description": "DSP retrieval-augmented generation setup for KiloCode",
  "skillOrWorkflow": "Skill"
}
