{
  "platform": "trae",
  "displayName": "Trae",
  "installType": "full",
  "folderStructure": {
    "root": ".trae",
    "skillPath": "skills/dsprag",
    "filename": "SKILL.md"
  },
  "scriptPath": "scripts/install-skill.mjs",
  "frontmatter": {
    "name": "dsprag",
    "description": "DSP RAG installer profile for Trae"
  },
  "sections": {
    "quickReference": true
  },
  "title": "DSP RAG Trae",
  "description": "DSP retrieval-augmented generation setup for Trae",
  "skillOrWorkflow": "Skill"
}
