{
  "platform": "opencode",
  "displayName": "OpenCode",
  "installType": "full",
  "folderStructure": {
    "root": ".opencode",
    "skillPath": "skills/dsprag",
    "filename": "SKILL.md"
  },
  "scriptPath": "scripts/install-skill.mjs",
  "frontmatter": {
    "name": "dsprag",
    "description": "DSP RAG installer profile for OpenCode"
  },
  "sections": {
    "quickReference": true
  },
  "title": "DSP RAG OpenCode",
  "description": "DSP retrieval-augmented generation setup for OpenCode",
  "skillOrWorkflow": "Skill"
}
